{
  "format": "ghosh-notation/1",
  "id": "keshav",
  "kind": "rachana",
  "title": {
    "dev": "केशवः",
    "rom": "Keshav"
  },
  "section": "mand-vanshi",
  "raga": {
    "name": "भैरवी",
    "aroha": "स री_ ग_ म प ध_ नि_ स'",
    "avaroha": "स' नि_ ध_ प म ग_ री_ स"
  },
  "notes": [
    "शेवटच्या चरणातील स्वरांवरील बाण (→) लयभंगाचे चिन्ह आहे; ते ! ने लिहिले आहे. आनकाच्या शेवटच्या त्र वरील उतरते चिन्ह त्र> असे लिहिले आहे.",
    "आनक चरण ३ ग्रंथात दोन ओळी :॥ असा आहे, तर वंशीत तो चरण चार ओळी पुनरावृत्तीशिवाय लिहिला आहे; म्हणून आनकाचा चरण ३ येथे दोनदा लिहिला आहे."
  ],
  "parts": {
    "vanshi": {
      "source": {
        "book": "vanshi",
        "page": 90,
        "pdfPage": 110,
        "edition": 6
      },
      "tala": "दादरा",
      "laya": 120,
      "status": "checked",
      "checkedBy": "Claude: line-by-line comparison with the page image, 2026-10-20",
      "lines": [
        "॥ॐ॥ प. स स | ध_. [सस] स | प. स स | ध_. – स ॥",
        "॥ प ऽ प | प ऽ प | [(पध_] नि_) ध_ | प ऽ म |",
        "| ग_ ग_ ग_ | [(सग_] [मप)] म | ग_ ऽ री | ग_ ऽ ऽ |",
        "| स ऽ ग_ | [(ग_म] म_) म | [(ग_री)] ग_ री_ | {1 स ऽ स :॥ }",
        "{2 स ऽ – ॥ }",
        "॥ ग_ ग_ म | ध_ ऽ नि_ | स' ऽ री_' | स' ऽ ऽ |",
        "| नि_ नि_ नि_ | स' ऽ स' | [(नि_ध_] नि_) ध_ | प ऽ [ऽ–] |",
        "| ग_ ग_ म | ध_ ऽ नि_ | [(स'री'] ग_') री' | स' ऽ ऽ |",
        "| नि_ नि_ नि_ | स' ऽ स' | [(नि_ध_] नि_) ध_ | प ऽ [ऽ–] ॥",
        "॥ प ऽ प | प ऽ प | [(ध_प] ध_) प | म ऽ ग_ |",
        "| स ऽ ग_ | (म प) म | री ग_ री | ग_ ऽ ऽ |",
        "| स ऽ ग_ | [(ग_म] म_) म | [(ग_री)] ग_ री_ | स ऽ स ॥",
        "॥ प ऽ प | प ऽ प | [(पध_] नि_) ध_ | प ऽ म |",
        "| ग_ ग_ ग_ | [(सग_] [मप)] म | ग_ ऽ री | ग_ ऽ ऽ |",
        "| स ऽ ग_ | [(ग_म] म_) म | [(ग_री)] ग_ री_ | स ऽ – ॥",
        "॥ स! री_! नि_.! | स! ऽ ऽ ॥"
      ]
    },
    "anak": {
      "source": {
        "book": "anak",
        "page": 100,
        "pdfPage": 121,
        "edition": 6
      },
      "tala": "दादरा",
      "laya": 120,
      "status": "checked",
      "checkedBy": "Claude: line-by-line comparison with the page image, 2026-10-20",
      "lines": [
        "॥ॐ॥ – त त | – [तत] त | – त त | त – – ॥",
        "॥ – त त | – त त | – त [तत] | त त त्र |",
        "| – त त | – त त | – त [तत] | त त त्र |",
        "| – त त | – त त | त्र ऽ ऽ | त – – :॥",
        "॥ – त त | – त त | – [तत] [तत] | – त त्र |",
        "| – त त | – त त | – [तत] [तत] | – त त्र |",
        "| – त त | – त त | – [तत] [तत] | – त त्र |",
        "| – त त | – त त | – [तत] [तत] | – त त्र ॥",
        "॥ – त त | – त त | – त त | – त [तत] |",
        "| – त त | – त त | – त त | – त त्र |",
        "| – त त | – त त | त्र ऽ ऽ | त – – ॥",
        "॥ – त त | – त त | – त [तत] | त त त्र |",
        "| – त त | – त त | – त [तत] | त त त्र |",
        "| – त त | – त त | त्र ऽ ऽ | त – – ॥",
        "॥ त्र> ऽ ऽ | ऽ ऽ ऽ ॥"
      ]
    }
  }
}
