{
  "format": "ghosh-notation/1",
  "id": "mangala",
  "kind": "rachana",
  "title": {
    "dev": "मंगला",
    "rom": "Mangala"
  },
  "section": "prachalan-shankh",
  "parts": {
    "shankh": {
      "source": {
        "book": "shankh",
        "page": 9,
        "pdfPage": 28,
        "edition": 6
      },
      "tala": "खेमटा",
      "laya": 360,
      "status": "checked",
      "checkedBy": "Claude: line-by-line comparison with the page image, 2026-10-20",
      "lines": [
        "॥ॐ॥ सऽग , पऽग | सऽग , पऽग | ससऽ , गगऽ | पऽऽ , ऽऽ– ॥",
        "॥ सऽऽ , सऽऽ | सऽ– , सप.स | गऽऽ , गऽऽ | गऽ– , गसग |",
        "| पऽप , गऽग | सऽस , प.ऽ– | प.ऽप. , सऽग | सऽ– , ––– :॥",
        { "t": ", ––स ॥", "pickup": true
        },
        "॥ प.ऽस , प.ऽस | प.ऽप. , सऽ– | गऽऽ , पगस | प.ऽऽ , ऽ–स |",
        "| प.ऽस , प.ऽस | प.ऽप. , सऽ– | गऽऽ , प.ऽप. | सऽ– , ––– :॥",
        "॥ सप.स , गऽग | पऽऽ , ऽऽप | गपग , सगस | प.ऽ– , प.ऽ– |",
        "| सप.स , गऽग | पऽऽ , ऽऽप | प.प.प. , सऽग | सऽ– , ––– :॥",
        "॥ पपऽ , गगऽ | ससऽ , प.प.ऽ | पगस , पगस | प.ऽऽ , ऽऽ– |",
        "| पपऽ , गगऽ | ससऽ , प.प.ऽ | पगस , प.प.ऽ | सऽ– , ––– :॥"
      ]
    },
    "anak": {
      "source": {
        "book": "anak",
        "page": 10,
        "pdfPage": 31,
        "edition": 6
      },
      "tala": "खेमटा",
      "laya": 360,
      "status": "checked",
      "checkedBy": "Claude: line-by-line comparison with the page image, 2026-10-20",
      "lines": [
        "॥ॐ॥ त–त्र , त–त्र | त–त्र , त–– | त्रत– , त्रत– | त–– , ––– ॥",
        "॥ त–त , त–त | त–– , ततत | त–त , त–त | त–– , ततत |",
        "| त–त , त–त | त–त , त–– | त्रऽऽ , ऽऽऽ | {1 त–– , ––– :॥ }",
        "{2 त–– , ––त्र ॥ }",
        "॥ त–त्र , त–त्र | त–त्र , त–– | त्रऽऽ , ऽऽऽ | त–– , ––त्र |",
        "| त–त्र , त–त्र | त–त्र , त–– | त्रऽऽ , ऽऽऽ | {1 त–– , ––त्र :॥ }",
        "{2 त–– , ––– ॥ }",
        "॥ ततत , त–त | त्रऽऽ , ऽत– | ततत , ततत | थ्र–– , थ्र–– |",
        "| ततत , त–त | त्रऽऽ , ऽत– | ततत , त–त्र | त–– , ––– :॥",
        "॥ त्रत– , ––– | त्रत– , ––– | त्रऽऽ , ऽऽऽ | त–– , ––– |",
        "| त्रत– , ––– | त्रत– , ––– | त्रऽऽ , तत– | त–– , ––– :॥"
      ]
    }
  }
}
