{
  "format": "ghosh-notation/1",
  "id": "deepnirvan-suchana",
  "kind": "udghosh",
  "title": {
    "dev": "दीपनिर्वाण सूचना",
    "rom": "Deepnirvan Suchana"
  },
  "section": "naimittik",
  "parts": {
    "shankh": {
      "source": {
        "book": "shankh",
        "page": 38,
        "pdfPage": 57,
        "edition": 6
      },
      "tala": "झपताल",
      "laya": 120,
      "status": "checked",
      "lines": [
        "॥ॐ॥ [पग] [पग] , प ग ग | [गस] [गस] , ग स स |",
        "| [प.ऽप.प.] [प.प.] , स ग प | [गऽगग] [गग] , स ऽ [ऽ–] ॥",
        "॥ प. स , ग [सग] [स–] | स ग , प [गप] [ग–] |",
        "| [सग] [पग] , [सग] [पग] [स–] | [प.ऽप.प.] [प.प.] , स! ऽ [ऽ–] ॥",
        "॥ [प.ऽप.प.] [प.स] , [प.स] [प.स] [ग–] | [सऽसस] [सग] , [सग] [सग] [प–] |",
        "| [पऽपप] [गप] , [गप] [गस] [स–] | [प.ऽप.प.] [प.प.] , स ग प |",
        "| [प.ऽप.प.] [प.प.] , स!< ऽ [ऽ–] ॥ @laya=100 स. स. , [स.प.]!< ऽ ऽ |",
        "| स. स. , [स.प.]!< ऽ ऽ | स. स. , [स.प.]!< ग!< स>! ॥"
      ],
      "checkedBy": "Claude: line-by-line comparison with the page image, 2026-10-20"
    }
  }
}
