{
  "format": "ghosh-notation/1",
  "id": "keshavashri",
  "kind": "rachana",
  "title": {
    "dev": "केशवश्री",
    "rom": "Keshavashri"
  },
  "section": "mand-vanshi",
  "notes": [
    "चरणांच्या सीमा ग्रंथात ओळीच्या मध्येच येतात; येथे प्रत्येक चरण नव्या ओळीवर सुरू केला आहे. चरणांची लांबी (गण) — २६, १२, २२, २२, २०, २६ — दोन्ही भागांत सारखीच आहे."
  ],
  "parts": {
    "vanshi": {
      "source": {
        "book": "vanshi",
        "page": 82,
        "pdfPage": 102,
        "edition": 6
      },
      "tala": "दादरा",
      "laya": 120,
      "status": "checked",
      "checkedBy": "Claude: line-by-line comparison with the page image, 2026-10-20",
      "lines": [
        "॥ॐ॥ री ऽ ऽ | – [पम_] प | म^ ऽ ऽ | – ग री |",
        "| ग^ ऽ ऽ | – नि. स | री ऽ री | ग ऽ ग |",
        "| म_ प म_ | री म ग | प. नि. री | प. म ग |",
        "| री ऽ ऽ | – [पम_] प | म^ ऽ ऽ | – ग री |",
        "| ग^ ऽ ऽ | – नि. स | री ऽ री | ग ऽ ग |",
        "| म_ प म_ | री म ग | प. नि. री | प. म ग |",
        "| री ग री | स ऽ – ॥",
        "॥ – [पम_] प | म^ ऽ ऽ |",
        "| – ग री | ग^ ऽ ऽ | – नि. स | री ऽ री |",
        "| ग ऽ ग | म_ प म_ | री म ग | प. नि. री |",
        "| प. म ग | री^ ऽ [ऽ–] ॥",
        "॥ – [पम_] प | म^ ऽ ऽ |",
        "| – ग री | ग ऽ – | प. नि. री | ग ऽ – |",
        "| प. नि. री | म_ ऽ – | री प म | ग ऽ – |",
        "| म_ री नि. | प. [नि.ध.] नि. | स ऽ – | नि. ध. नि. |",
        "| री ऽ – | [रीप] [म_प] म_ | प ऽ – | [गम] [रीग] री |",
        "| प. नि. री | प. म ग | री ग री | स ऽ – ॥",
        "॥ – [पम_] प | म ऽ ग | नि. स री | ग ऽ – |",
        "| [गम] [रीग] [सरी] | म_ ऽ – | [म_प] [गम] [रीग] | प ऽ – |",
        "| [रीग] [पध] [म_ध] | म ऽ ग | [रीग] [मग] [रीम] | ग ऽ – |",
        "| – [पम_] प | री – – | – [पम_] प | म^ ऽ ऽ |",
        "| – ग री | ग ऽ – | – नि. स | री ऽ री |",
        "| ग ऽ ग | [पम_] [गरी] स ॥",
        "॥ – [पम_] प | म^ ऽ ऽ |",
        "| – ग री | ग ऽ – | [नि.स] [रीग] [रीग] | [नि.स] [रीम] [गम] |",
        "| [रीग] [नि.स] [रीप] | [म_प] [गम] [रीग] | [नि.स] री [नि.स] | री [नि.स] री |",
        "| – [पम_] प | म^ ऽ ऽ | – ग री | ग^ ऽ ऽ |",
        "| – नि. स | री ऽ री | री प म | री म ग |",
        "| री ग री | स ऽ – ॥",
        "॥ – [पम_] प | म^ ऽ ऽ |",
        "| – ग री | ग ऽ – | नि. स री | [पप] प – |",
        "| नि. स री | [मम] म – | नि. स ग | री ऽ री |",
        "| [नि.स] [रीम] ग | – [नि.स] [रीप] | म – [रीम] | ग – [सग] |",
        "| री – [नि.री] | स – [पम_] | – [मग] – | [रीस] – – |",
        "| [पम_] प म | [पम_] प म | [पम_] प म | म^ ऽ ऽ |",
        "| – ग री | ग^ ऽ – | – नि. नि. | स^ ऽ – ॥"
      ]
    },
    "anak": {
      "source": {
        "book": "anak",
        "page": 94,
        "pdfPage": 115,
        "edition": 6
      },
      "tala": "दादरा",
      "laya": 120,
      "status": "checked",
      "checkedBy": "Claude: line-by-line comparison with the page image, 2026-10-20",
      "lines": [
        "॥ॐ॥ त्र ऽ त | – [तत] त | त्र ऽ त | – त त |",
        "| त्र ऽ त | – त त | त्र ऽ त | त्र ऽ त |",
        "| – त त | त त त | – त त | त त त |",
        "| त्र ऽ त | – [तत] त | त्र ऽ त | – त त |",
        "| त्र ऽ त | – त त | त्र ऽ त | त्र ऽ त |",
        "| त्र ऽ ऽ | त त त | त्र ऽ ऽ | त त त |",
        "| त ऽ ऽ | त – – ॥",
        "॥ – [तत] त | त्र ऽ त |",
        "| – त त | त्र ऽ त | – त त | त त्र त |",
        "| त त्र त | त त त | त त त | – त त |",
        "| त्र ऽ ऽ | त – – ॥",
        "॥ – [तत] त | त्र ऽ त |",
        "| – त त | त – – | त्र ऽ त | त्र त – |",
        "| त्र ऽ त | त्र त – | त्र ऽ त | त्र त – |",
        "| त्र ऽ ऽ | त [तत] त | त्र त – | त त त |",
        "| त्र त – | [तत] [तत] त्र | त – – | [तत] [तत] त्र |",
        "| त त त | – त त | त्र ऽ ऽ | त – – ॥",
        "॥ – [तत] त | त्र ऽ त | त्र ऽ ऽ | त – – |",
        "| [तत] [तत्र] [तत] | त – – | [तत] [तत्र] [तत] | त – – |",
        "| [तत] [तत्र] [तत] | त त त | [तत] [तत्र] [तत] | त – – |",
        "| – [तत] त | त – – | – [तत] त | त्र ऽ त |",
        "| – त त | त – – | – त त | त्र ऽ त |",
        "| त त त | [तत] [तत्र] त ॥",
        "॥ – [तत] त | त्र ऽ त |",
        "| – त त | त – – | [तत] [तत्र] [तत] | त्र ऽ ऽ |",
        "| [तत] [तत्र] [तत] | त्र ऽ ऽ | [तत] त्र [तत] | त्र [तत] त |",
        "| – [तत] त | त्र ऽ त | – त त | त्र ऽ त |",
        "| – त त | त्र ऽ त | त त त | – त त |",
        "| त्र ऽ ऽ | त – – ॥",
        "॥ – [तत] त | त्र ऽ त |",
        "| – त त | त – – | त त त | [तत] त – |",
        "| – त त | [तत] त – | त त त | त्र ऽ त |",
        "| [तत] [तत्र] त | – [तत] [तत] | त – [तत] | त – [तत] |",
        "| त – [तत] | त – [तत] | – त्र त | [तत] – – |",
        "| त्र त त | त त त | [तत] त त | त्र ऽ त |",
        "| – त त | त – – | – त त्र | त – – ॥"
      ]
    }
  }
}
