{
  "format": "ghosh-notation/1",
  "id": "bageshri",
  "kind": "rachana",
  "title": {
    "dev": "बागेश्री",
    "rom": "Bageshri"
  },
  "section": "mand-vanshi",
  "raga": {
    "name": "बागेश्री",
    "aroha": "स ग_ म ध नि_ स'",
    "avaroha": "स' नि_ ध म प ध म ग_ री स"
  },
  "parts": {
    "vanshi": {
      "source": {
        "book": "vanshi",
        "page": 77,
        "pdfPage": 97,
        "edition": 6
      },
      "tala": "दादरा",
      "laya": 120,
      "status": "checked",
      "checkedBy": "Claude: line-by-line comparison with the page image, 2026-10-20",
      "lines": [
        "॥ॐ॥ ध ऽ नि_ | ध ऽ म | ग_ ऽ [मग_] | री ऽ स |",
        "| नि_. स ग_ | म ध नि_ | स' ऽ स' | स' नि_ स' |",
        "| ध ऽ नि_ | ध ऽ म | ग_ ऽ [मग_] | री ऽ स |",
        "| नि_. स म | ग_ ऽ री | स ऽ ऽ | ऽ – – :॥",
        "॥ म ग_ म | ध ऽ ध | [पध] नि_ ध | स' ऽ ऽ |",
        "| ध नि_ स' | ग_' ऽ री' | स' ऽ नि_ | ध ऽ ध |",
        "| म ग_ म | ध ऽ ध | [पध] नि_ ध | स' ऽ ऽ |",
        "| म प ध | म ऽ ग_ | री ऽ ऽ | स ऽ [ऽ–] :॥"
      ]
    },
    "anak": {
      "source": {
        "book": "anak",
        "page": 91,
        "pdfPage": 112,
        "edition": 6
      },
      "tala": "दादरा",
      "laya": 120,
      "status": "checked",
      "checkedBy": "Claude: line-by-line comparison with the page image, 2026-10-20",
      "lines": [
        "॥ॐ॥ – त त | – त त | – त त | त [तत] त |",
        "| – त त | – त त | त्र ऽ ऽ | त त्र त |",
        "| – त त | – त त | – त त | त [तत] त |",
        "| – त त | – त त | त्र ऽ ऽ | त – – :॥",
        "॥ त्र ऽ ऽ | त त्र त | [तत्र] [तत्र] त | त्र ऽ ऽ |",
        "| त त त | त त्र त | – त त | – त त |",
        "| त्र ऽ ऽ | त त्र त | [तत्र] [तत्र] त | त्र ऽ ऽ |",
        "| त त त | त त्र त | त्र ऽ ऽ | त – – :॥"
      ]
    }
  }
}
