{
  "format": "ghosh-notation/1",
  "id": "kalyani",
  "kind": "rachana",
  "title": {
    "dev": "कल्याणी",
    "rom": "Kalyani"
  },
  "section": "prachalan-vanshi",
  "raga": {
    "name": "मेचकल्याणी",
    "aroha": "स री ग म_ प ध नि स'",
    "avaroha": "स' नि ध प म_ ग री स"
  },
  "parts": {
    "vanshi": {
      "source": {
        "book": "vanshi",
        "page": 20,
        "pdfPage": 40,
        "edition": 6
      },
      "tala": "खेमटा",
      "laya": 360,
      "status": "checked",
      "checkedBy": "Claude: line-by-line comparison with the page image, 2026-10-20",
      "lines": [
        "॥ॐ॥ निऽऽ , स'ऽनि | धपम_ , गऽऽ | रीऽऽ , नि.ऽरी | सऽ– , ––– ॥",
        "॥ नि.ऽरी , गऽरी | म_ऽरी , गऽरी | नि.ऽरी , गऽरी | सऽऽ , नि.ऽध. |",
        "| नि.ऽरी , गऽरी | म_ऽरी , गऽरी | नि.ऽरी , ध.ऽनि. | सऽऽ , ऽऽ– :॥",
        "॥ पऽम_ , धऽप | निऽध , पऽम_ | रीगरी , सऽऽ | नि.ऽरी , गऽऽ |",
        "| पऽम_ , धऽप | निऽध , पऽम_ | रीगरी , नि.ऽरी | सऽऽ , ऽऽ– :॥",
        "॥ निऽरी' , स'ऽनि | धनिस' , निऽध | पऽग , म_ऽरी | गम_ध , पऽऽ |",
        "| स'ऽध , निऽप | धनिस' , निऽध | पऽम_ , गऽरी | {1 सऽऽ , ऽऽ– :॥ }",
        {
          "t": "{2 सऽ– , ––नि. | रीऽ– , ––स | गऽ– , ––री | सऽ– , सऽस |",
          "note": "पुस्तक में यहाँ '–नि़' (एक ही –) छपा है; खेमटा गट में तीन मात्राएँ चाहिए, इसलिए आगे की '––स', '––री' की तरह '––नि़' पढ़ा है।"
        },
        "| सऽ– , ––– ॥ }"
      ]
    },
    "anak": {
      "source": {
        "book": "anak",
        "page": 48,
        "pdfPage": 69,
        "edition": 6
      },
      "tala": "खेमटा",
      "laya": 360,
      "status": "checked",
      "checkedBy": "Claude: line-by-line comparison with the page image, 2026-10-20",
      "lines": [
        "॥ॐ॥ त्रऽऽ , त–त | ततत , त्रऽऽ | त–– , त्रऽऽ | त–– , ––– ॥",
        "॥ ततत , त्रऽऽ | ततत , त्रऽऽ | त–त्र , त–त्र | त–त्र , त–त्र |",
        "| ततत , त्रऽऽ | ततत , त्रऽऽ | त–त्र , त–त्र | त–त्र , त–– :॥",
        "॥ ततत , त–त्र | ततत , त–त्र | ततत , ततत | ततत , त–त्र |",
        "| ततत , त–त्र | ततत , त–त्र | ततत , ततत | त्रऽऽ , त–– :॥",
        "॥ ततत , त–– | ततत , त–– | त–त , त–त | त्रऽऽ , ऽऽऽ |",
        "| ततत , त–– | ततत , त–– | त–त , त–त | {1 त्रऽऽ , त–– :॥ }",
        "{2 त–– , ––त्र |",
        "| त–– , ––त्र | त–– , ––त्र | त–– , ––त्र | त–– , ––– ॥ }"
      ]
    }
  }
}