{
  "format": "ghosh-notation/1",
  "id": "bajrang",
  "kind": "rachana",
  "title": {
    "dev": "बजरंग",
    "rom": "Bajrang"
  },
  "section": "prachalan-shankh",
  "parts": {
    "shankh": {
      "source": {
        "book": "shankh",
        "page": 19,
        "pdfPage": 38,
        "edition": 6
      },
      "tala": "खेमटा",
      "laya": 360,
      "headingTala": "खेमटा-३६० केरवा-१२०",
      "status": "checked",
      "checkedBy": "Claude: line-by-line comparison with the page image, 2026-10-20",
      "lines": [
        "॥ॐ॥ पगस , पगस | प.सग , सऽ– | पऽग , सऽग | पऽऽ , ऽ–– ॥",
        "॥ सऽस , सप.स | गऽग , गपग | पऽप , पगस | प.ऽऽ , सऽग |",
        "| सऽस , सप.स | गऽग , गपग | पऽ– , गपग | सऽऽ , ऽ–– :॥",
        { "t": ", ––प. ॥", "pickup": true
        },
        "॥ सऽप. , सऽप. | सऽग , पऽ– | प.प.प. , सऽग | स.ऽस. , स.ऽप. |",
        "| सऽप. , सऽप. | सऽग , पऽ– | प.प.प. , गगग | सऽऽ , ऽ–– :॥",
        "॥ @tala=केरवा-१२० [सस] [गस] | [प.स] [ग–] | [गऽगग] [पग] | [सग] प |",
        "| [पऽपप] [गप] | ग [स–] | [पप] [गप] | ग [स–] |",
        "| [सस] [गस] | [प.स] [ग–] | [गऽगग] [पग] | [सग] प |",
        "| [पऽपप] [गप] | ग [स–] | [स–] [सऽऽस] | [स–] – :॥",
        "॥ [पग] [सग] | [प.प.प.प.] [सग] | [गप] [ऽप] | [गपगऽ] [स–] |",
        "| [पग] [सग] | [प.प.प.प.] [सग] | स [ऽऽसग] | [स–] – :॥"
      ]
    },
    "anak": {
      "source": {
        "book": "anak",
        "page": 21,
        "pdfPage": 42,
        "edition": 6
      },
      "tala": "खेमटा",
      "laya": 360,
      "headingTala": "खेमटा-३६० केरवा-१२०",
      "status": "checked",
      "checkedBy": "Claude: line-by-line comparison with the page image, 2026-10-20",
      "lines": [
        "॥ॐ॥ ततत , ततत | ततत , त–– | त–त्र , त–त्र | त–– , ––– ॥",
        "॥ त–त , तत्रत | त–त , तत्रत | त–त , त्रऽऽ | ऽऽऽ , त–त्र |",
        "| त–त , तत्रत | त–त , तत्रत | त्रऽऽ , तत्रत | {1 त–– , ––– :॥ }",
        "{2 त–– , ––त्र ॥ }",
        "॥ त–त्र , त–त्र | त–त , त–– | त्रऽऽ , त–त | ––– , ––त्र |",
        "| त–त्र , त–त्र | त–त , त–– | त्रऽऽ , ऽऽऽ | {1 त–– , ––त्र :॥ }",
        "{2 त–– , ––– ॥ }",
        "॥ @tala=केरवा-१२० [तत्र] [तत्र] | [तत] त | [त–तत] [त्रत] | [तत्र] त |",
        "| [`त्रत–तत] [तत] | त्र त | [त्रत] [त्रत] | त्र त |",
        "| [तत्र] [तत्र] | [तत] त | [त–तत] [त्रत] | [तत्र] त |",
        "| [`त्रत–तत] [तत] | त्र त | त [त––त्र] | त – :॥",
        "॥ [त्रत] [तत्र] | [तततत] [तत] | [तत्र] [ऽत] | [ततत–] त |",
        "| [त्रत] [तत्र] | [तततत] [तत] | त [–त्र] | त – :॥"
      ]
    }
  }
}
