{
  "format": "ghosh-notation/1",
  "id": "pratidhvani",
  "kind": "rachana",
  "title": {
    "dev": "प्रतिध्वनि",
    "rom": "Pratidhvani"
  },
  "section": "prachalan-shankh",
  "parts": {
    "shankh": {
      "source": {
        "book": "shankh",
        "page": 12,
        "pdfPage": 31,
        "edition": 6
      },
      "tala": "खेमटा",
      "laya": 360,
      "status": "checked",
      "checkedBy": "Claude: line-by-line comparison with the page image, 2026-10-20",
      "lines": [
        "॥ॐ॥ सऽग , पऽऽ | गऽ– , पऽग | सऽग , पऽऽ | गपग , सऽप. |",
        "| सऽग , पऽऽ | गऽ– , पऽग | सप.स , गपग | सऽऽ , ऽऽ– :॥",
        "॥ प.ऽऽ , सऽऽ | प.ऽऽ , गऽऽ | पऽप , पऽप | पऽऽ , ऽऽ– |",
        "| प.ऽऽ , सऽऽ | प.ऽऽ , गऽऽ | प.ऽप. , प.ऽप. | सऽऽ , ऽऽ– :॥",
        { "t": ", ––स ॥", "pickup": true
        },
        "॥ गऽऽ , ऽऽप | गऽऽ , ऽऽस | गऽऽ , ऽऽप | पऽ– , गऽस |",
        "| गऽऽ , ऽऽप | गऽऽ , ऽऽस | प.ऽ– , प.ऽप. | सऽ– , ––– :॥"
      ]
    },
    "anak": {
      "source": {
        "book": "anak",
        "page": 14,
        "pdfPage": 35,
        "edition": 6
      },
      "tala": "खेमटा",
      "laya": 360,
      "status": "checked",
      "checkedBy": "Claude: line-by-line comparison with the page image, 2026-10-20",
      "lines": [
        "॥ॐ॥ त–त , त्रऽऽ | त–– , त–त | त–त , त्रऽऽ | ततत , त–त |",
        "| त–त , त्रऽऽ | त–– , त–त | ततत , ततत | त्रऽऽ , त–– :॥",
        "॥ त–– , त–– | त–– , त–– | त–त , त–त | त्रऽऽ , ऽऽऽ |",
        "| त–– , त–– | त–– , त–– | त–त , त–त | {1 त–– , ––– :॥ }",
        "{2 त–– , ––त्र ॥ }",
        "॥ त–त्र , त–त्र | ततत , त–त्र | त–त्र , त–त्र | त–– , ––त्र |",
        "| त–त्र , त–त्र | ततत , त–त्र | त–त्र , त–त्र | {1 त–– , ––त्र :॥ }",
        "{2 त–– , ––– ॥ }"
      ]
    }
  }
}
