{
  "format": "ghosh-notation/1",
  "id": "indraprastha",
  "kind": "rachana",
  "title": {
    "dev": "इंद्रप्रस्थ",
    "rom": "Indraprastha"
  },
  "section": "mand-vanshi",
  "raga": {
    "name": "श्यामकल्याण"
  },
  "notes": [
    "वंशी चरण २ चे दुसरे आवर्तन ग्रंथात 'स  नि.स' (दोनच मात्रा) असे छापले आहे; दादऱ्याचा गण तीन मात्रांचा असल्याने ते 'स – नि.स' असे वाचले आहे (चरण ३ च्या पहिल्या आवर्तनाप्रमाणे)."
  ],
  "parts": {
    "vanshi": {
      "source": {
        "book": "vanshi",
        "page": 72,
        "pdfPage": 92,
        "edition": 6
      },
      "tala": "दादरा",
      "laya": 120,
      "status": "checked",
      "checkedBy": "Claude: line-by-line comparison with the page image, 2026-10-20",
      "lines": [
        "॥ॐ॥ ग प स' | नि ऽ – | प ग [पध] | नि_ ऽ ध |",
        "| म_ ऽ म_ | प – म_ | प स' नि | प नि_ ध |",
        "| प ग प | ग प स' | नि ऽ – | प ग [पनि_] |",
        "| ध ऽ ध | म_ ऽ म_ | प ऽ म_ | प – – :॥",
        "॥ [नि_ध] [पम_] प | स' ऽ – | नि प [धस'] | नि ऽ – |",
        "| [धनि] [री'नि] प | म ऽ – | ग म री | प ऽ – |",
        "| [पम_] [पनि] स' | [पम_] [पनि_] ध | प म_ म | री ऽ – |",
        "| [रीम_] [पनि] स' | [निध] [पम] री | री म नि. | {1 स – – :॥ }",
        "{2 स – [नि.स] ॥ }",
        "॥ री ऽ – | म री [रीप] | म_ ऽ – | ध म_ म |",
        "| ग ऽ – | म_ नि. स | [रीग] [मप] म_ | प ऽ – |",
        "| प नि नि | प स' [निध] | प ग म | री ऽ – |",
        "| ग प म_ | री म [गरी] | स ऽ स | {1 स – [नि.स] :॥ }",
        "{2 स – – ॥ }"
      ]
    },
    "anak": {
      "source": {
        "book": "anak",
        "page": 87,
        "pdfPage": 108,
        "edition": 6
      },
      "tala": "दादरा",
      "laya": 120,
      "status": "checked",
      "checkedBy": "Claude: line-by-line comparison with the page image, 2026-10-20",
      "lines": [
        "॥ॐ॥ त त त | त्र ऽ ऽ | त त्र त | त्र ऽ त |",
        "| त्र ऽ त | त – – | – त त | – त त |",
        "| – त्र त | त त त | त्र ऽ ऽ | त त्र त |",
        "| त्र ऽ त | त्र ऽ त | त्र ऽ त | त – – :॥",
        "॥ त [ततत] त | त्र ऽ त | त [ततत] त | त्र ऽ त |",
        "| त्र ऽ त | त [ततत] [ततत] | त त त | त्र ऽ त |",
        "| [तत्र] [तत्र] ऽ | [तत्र] [तत्र] ऽ | त त त | – त त |",
        "| [तत्र] [तत्र] त | [तत्र] [तत्र] त | त त त | {1 त – – :॥ }",
        "{2 त – त्र ॥ }",
        "॥ त त्र ऽ | त त [तत्र] | त त्र ऽ | त – त |",
        "| त त्र ऽ | त त [तत्र] | त त्र ऽ | त त्र ऽ |",
        "| त – त | – त त | त त्र त | त – त |",
        "| त – त | – त त | त्र ऽ ऽ | {1 त – त्र :॥ }",
        "{2 त – – ॥ }"
      ]
    }
  }
}
