{
  "format": "ghosh-notation/1",
  "id": "dashmesh",
  "kind": "rachana",
  "title": {
    "dev": "दशमेश",
    "rom": "Dashmesh"
  },
  "section": "prachalan-shankh",
  "parts": {
    "shankh": {
      "source": {
        "book": "shankh",
        "page": 6,
        "pdfPage": 25,
        "edition": 6
      },
      "tala": "खेमटा",
      "laya": 360,
      "status": "checked",
      "checkedBy": "Claude: line-by-line comparison with the page image, 2026-10-20",
      "lines": [
        "॥ॐ॥ प.ऽप. , सऽ– | गऽग , पऽ– | गऽऽ , पऽग | सऽऽ , ऽ–– ॥",
        "॥ प.सग , प.ऽस | गऽ– , गऽ– | ससस , सऽस | प.ऽऽ , ऽऽस |",
        "| प.सग , प.ऽस | गऽ– , गऽ– | सऽ– , गगग | सऽऽ , ऽ–– :॥",
        "॥ सऽग , पऽग | ससस , सऽ– | सऽग , प.ऽप. | गगग , गऽ– |",
        "| सऽग , पऽग | ससस , सऽ– | सऽग , पऽप. | सऽऽ , ऽ–– :॥",
        { "t": ", ––प. ॥", "pickup": true
        },
        "॥ ससस , सऽस | गगग , पऽ– | गसग , पऽ– | पऽऽ , ––प. |",
        "| ससस , सऽस | गगग , पऽ– | गसग , पऽ– | सऽऽ , ऽ–– :॥"
      ]
    },
    "anak": {
      "source": {
        "book": "anak",
        "page": 7,
        "pdfPage": 28,
        "edition": 6
      },
      "tala": "खेमटा",
      "laya": 360,
      "status": "checked",
      "checkedBy": "Claude: line-by-line comparison with the page image, 2026-10-20",
      "lines": [
        "॥ॐ॥ त–त , त–– | त–त्र , त–– | त्रऽऽ , ऽऽऽ | त–– , ––– ॥",
        "॥ ततत , त–त | थ्र–– , थ्र–– | त्रऽऽ , त–त | त्रऽऽ , ऽऽऽ |",
        "| ततत , त–त | थ्र–– , थ्र–– | त्रऽऽ , ततत | त–– , ––– :॥",
        "॥ त–त्र , त–त्र | ततत , त–– | त्रऽऽ , ऽऽऽ | ततत , त–– |",
        "| त–त्र , त–त्र | ततत , त–– | त–त्र , त–त्र | {1 त–– , ––– :॥ }",
        "{2 त–– , ––त्र ॥ }",
        "॥ ततत , त–त | त्र^ऽऽ , ऽ^ऽऽ | ऽ^ऽऽ , ऽ^ऽऽ | ऽ^ऽऽ , त–त्र |",
        "| ततत , त–त | त्र^ऽऽ , ऽ^ऽऽ | ऽ^ऽऽ , ऽ^ऽऽ | {1 त–– , ––त्र :॥ }",
        "{2 त–– , ––– ॥ }"
      ]
    }
  }
}
