{
  "format": "ghosh-notation/1",
  "id": "kairali",
  "kind": "rachana",
  "title": {
    "dev": "कैरलि",
    "rom": "Kairali"
  },
  "section": "prachalan-vanshi",
  "raga": {
    "name": "रेवति",
    "aroha": "स री_ म प नि_ स'",
    "avaroha": "स' नि_ प म री_ स"
  },
  "parts": {
    "vanshi": {
      "source": {
        "book": "vanshi",
        "page": 28,
        "pdfPage": 48,
        "edition": 6
      },
      "tala": "केरवा",
      "laya": 120,
      "status": "checked",
      "checkedBy": "Claude: line-by-line comparison with the page image, 2026-10-20",
      "lines": [
        "॥ॐ॥ स' [नि_प] | म री_ | [नि_.नि_.] [री_री_] | स स |",
        "| स री_ | म नि_ | [पप] [री_'री_'] | स' [स'–] :॥",
        "॥ नि_ [स'री_'] | स' [स'स'] | नि_ [स'नि_] | प प |",
        "| स' [नि_प] | म [री_स] | नि_. री_ | स [ऽ–] :॥",
        "॥ नि_. [सरी_] | स [प.प.] | [सरी_] [री_–] | [री_री_] [री_–] |",
        "| म [पनि_] | स' [स'स'] | प री_' | स' [ऽस'] :॥",
        "॥ स' [री_'स'] | नि_ [स'नि_] | प [नि_प] | [मप] म |",
        "| स [री_म] | प [नि_प] | म [पप] | स' [ऽ–] :॥"
      ]
    },
    "anak": {
      "source": {
        "book": "anak",
        "page": 53,
        "pdfPage": 74,
        "edition": 6
      },
      "tala": "केरवा",
      "laya": 120,
      "status": "checked",
      "checkedBy": "Claude: line-by-line comparison with the page image, 2026-10-20",
      "lines": [
        "॥ॐ॥ त त्र | ऽ ऽ | [तत्र] [तत्र] | त त |",
        "| त्र ऽ | ऽ ऽ | [तत्र] [तत्र] | त – :॥",
        "॥ त [++] | त [++] | त [++] | त्र ऽ |",
        "| त [++] | त [++] | त्र ऽ | त – :॥",
        "॥ त्र [तत] | त्र [तत] | [–त] त | [–त] त |",
        "| त्र [तत] | त्र [तत] | त त्र | त – :॥",
        "॥ [तत्र] [ऽत] | [तत्र] [ऽत] | [तत्र] [ऽत] | [तत] त |",
        "| [तत्र] [ऽत] | [तत्र] [ऽत] | [तत] [–त] | त – :॥"
      ]
    }
  }
}
