{
  "format": "ghosh-notation/1",
  "id": "ranjit",
  "kind": "rachana",
  "title": {
    "dev": "रणजित",
    "rom": "Ranjit"
  },
  "section": "prachalan-shankh",
  "parts": {
    "shankh": {
      "source": {
        "book": "shankh",
        "page": 14,
        "pdfPage": 33,
        "edition": 6
      },
      "tala": "केरवा",
      "laya": 120,
      "status": "checked",
      "checkedBy": "Claude: line-by-line comparison with the page image, 2026-10-20",
      "lines": [
        "॥ॐ॥ [पऽपप] [पप] | [गप] [गस] | [पऽपप] [पप] | प [ऽ–] ॥",
        "॥ प [ऽऽसग] | प [ऽऽसग] | [पऽऽप] [पऽऽप] | स [ग–] |",
        "| प [ऽऽसग] | प [ऽ–] | [पऽऽप] [पऽऽप] | स [ऽ–] :॥",
        {
          "t": "[–प.] ॥",
          "pickup": true
        },
        "॥ [सऽसस] [गऽगग] | प [ऽप] | [पपपऽ] [सग] | प [–प.] |",
        "| [सऽसस] [गऽगग] | प [ऽप] | [प.प.प.ऽ] [गग] | स [ऽ–] :॥",
        "॥ [पग] [सग] | [पऽऽप] [प–] | [प.ऽसग] [पगसप.] | [सऽसस] [स–] |",
        "| [पग] [सग] | [पऽऽप] [प–] | [प.ऽसग] [पगसप.] | [स–] – :॥",
        "॥ [ससऽस] [सप.] | [गगगग] [सग] | [पप] [पप] | [पप] [पप] |",
        "| [ससऽस] [सप.] | [गगगग] [सग] | [पप] [पप] | स [ऽ–] :॥"
      ]
    },
    "anak": {
      "source": {
        "book": "anak",
        "page": 16,
        "pdfPage": 37,
        "edition": 6
      },
      "tala": "केरवा",
      "laya": 120,
      "status": "checked",
      "checkedBy": "Claude: line-by-line comparison with the page image, 2026-10-20",
      "lines": [
        "॥ॐ॥ [`त्रत–तत] [तत] | [–त] [–त] | [––तत] [तत] | त – ॥",
        "॥ त्र [ऽत] | त्र [ऽत] | [त––त] [त––त] | थ्र थ्र |",
        "| त्र [ऽत] | त्र [ऽत] | [त––त] [त––त] | {1 त – :॥ }",
        "{2 त [–त्र] ॥ }",
        "॥ [त–तत] [त–तत] | त्र ऽ | [ततत–] [तत] | त [–त्र] |",
        "| [त–तत] [त–तत] | त्र ऽ | [ततत–] [तत्र] | {1 त [–त्र] :॥ }",
        "{2 त – ॥ }",
        "॥ [त्रत] [त्रत] | [त––त] त | [त–तत] [तततत] | [––तत] त |",
        "| [त्रत] [त्रत] | [त––त] त | [त–तत] [तततत] | त – :॥",
        "॥ [तत–त] [तत] | त्र [तत] | [थत] [थत] | [थत] [थत] |",
        "| [तत–त] [तत] | त्र [तत] | [त्रत] [त्रत] | त – :॥"
      ]
    }
  }
}