{
  "format": "ghosh-notation/1",
  "id": "pahadi",
  "kind": "rachana",
  "title": {
    "dev": "पहाड़ी",
    "rom": "Pahadi"
  },
  "section": "prachalan-vanshi",
  "raga": {
    "name": "पहाड़ी",
    "aroha": "स री ग प ध स'",
    "avaroha": "स' नि_ ध प म ग री स"
  },
  "parts": {
    "vanshi": {
      "source": {
        "book": "vanshi",
        "page": 6,
        "pdfPage": 26,
        "edition": 6
      },
      "tala": "केरवा",
      "laya": 120,
      "status": "checked",
      "checkedBy": "Claude: line-by-line comparison with the page image, 2026-10-20",
      "lines": [
        "॥ॐ॥ [ध.स] स | [रीम] म | [–ग] [रीग] | री [स–] ॥",
        "॥ [ध.स] स | [रीम] म | [पध] ध | [पम] [(गरीसरी)] |",
        "| [रीप] प | [मग] [रीस] | री [सस] | {1 स [(रीसध.ऽ)] :॥ }",
        "{2 स [ऽ–] ॥ }",
        "॥ [पध] [मप] | [धस'] स' | [स'री'] [(स'री'ग'ऽ)] | री' स' |",
        "| [स'री'] [(स'री'ग'ऽ)] | री' [स'री'] | स' ऽ | {1 [नि_ध] प :॥ }",
        "{2 [ऽ–] – ॥ }",
        "॥ [पप] [पध] | [धस'] स' | [स'री'] [स'री'] | [स'नि_] [धप] |",
        "| [रीम] म | [पध] [नि_ध] | {1 प ध | नि_ स' :॥ }",
        "{2 प ऽ | [मग] [रीस] ॥ }"
      ]
    },
    "anak": {
      "source": {
        "book": "anak",
        "page": 36,
        "pdfPage": 57,
        "edition": 6
      },
      "tala": "केरवा",
      "laya": 120,
      "status": "checked",
      "checkedBy": "Claude: line-by-line comparison with the page image, 2026-10-20",
      "lines": [
        "॥ॐ॥ [तत] त | [तत्र] त | [–त] त्र | त त ॥",
        "॥ [तत्र] त | [तत] त | [तत्र] त | [तत] [तततत] |",
        "| [तत्र] त | [तत] [तत] | {1 त त | त त्र :॥ }",
        "{2 त त्र | त – ॥ }",
        "॥ [त्रत] [त्रत] | [तत] त | त्र [ततत–] | [तत्र] त |",
        "| त्र [ततत–] | त त्र | त त्र | {1 [तत्र] त :॥ }",
        "{2 त – ॥ }",
        "॥ [–त] [तत] | [तत्र] त | [–त] [–त] | [–त्र] [तत] |",
        "| [तत्र] त | [–त] [–त] | {1 त्र ऽ | ऽ त :॥ }",
        "{2 त्र ऽ | [तत्र] [तत्र] ॥ }"
      ]
    }
  }
}
