{
  "format": "ghosh-notation/1",
  "id": "parivartan",
  "kind": "udghosh",
  "title": {
    "dev": "परिवर्तन",
    "rom": "Parivartan"
  },
  "section": "naimittik",
  "parts": {
    "shankh": {
      "source": {
        "book": "shankh",
        "page": 36,
        "pdfPage": 55,
        "edition": 6
      },
      "tala": "केरवा",
      "laya": 120,
      "status": "checked",
      "checkedBy": "Claude: line-by-line comparison with the page image, 2026-10-20",
      "lines": [
        "॥ॐ॥ स^! ऽ :॥"
      ]
    }
  }
}
