{
  "format": "ghosh-notation/1",
  "id": "jagannath",
  "kind": "rachana",
  "title": {
    "dev": "जगन्नाथ",
    "rom": "Jagannath"
  },
  "section": "prachalan-shankh",
  "parts": {
    "shankh": {
      "source": {
        "book": "shankh",
        "page": 15,
        "pdfPage": 34,
        "edition": 6
      },
      "tala": "खेमटा",
      "laya": 360,
      "status": "checked",
      "checkedBy": "Claude: line-by-line comparison with the page image, 2026-10-20",
      "lines": [
        "॥ॐ॥ गपप , पऽप | गपप , पऽप | गपग , सऽग | पऽऽ , ऽ–– ॥",
        "॥ पऽप , पऽ– | गऽग , गऽ– | प.ऽऽ , सगग | पऽऽ , ऽ–– |",
        "| पऽप , पऽ– | गऽग , गऽ– | पऽ– , प.सग | सऽऽ , ऽ–– :॥",
        { "t": ", –प.स ॥", "pickup": true
        },
        "॥ गऽग , गऽग | पऽऽ , –सग | पऽग , पऽग | सऽ– , –प.स |",
        "| गऽग , गऽग | पऽऽ , –सग | पपप , गऽग | सऽऽ , ऽ–– :॥",
        "॥ पऽऽ , पऽ– | प.सग , पगस | प.सग , पगस | गपऽ , ऽ–– |",
        "| पऽऽ , पऽ– | प.सग , पगस | प.सग , पऽप. | सऽऽ , ऽ–– :॥",
        { "t": ", ––प. ॥", "pickup": true
        },
        "॥ सऽस , सऽप. | गऽग , गऽस | पऽप , पऽग | प.ऽ– , ––प. |",
        "| सऽस , सऽप. | गऽग , गऽस | पऽ– , प.प.प. | सऽ– , ––– :॥"
      ]
    },
    "anak": {
      "source": {
        "book": "anak",
        "page": 17,
        "pdfPage": 38,
        "edition": 6
      },
      "tala": "खेमटा",
      "laya": 360,
      "status": "checked",
      "checkedBy": "Claude: line-by-line comparison with the page image, 2026-10-20",
      "lines": [
        "॥ॐ॥ त्रतत , त–त | त्रतत , त–त | त–– , त्रऽऽ | त–– , ––– ॥",
        "॥ त्र–त्र , त–– | त्र–त्र , त–– | त–– , तत्रत | त–– , ––– |",
        "| त्र–त्र , त–– | त्र–त्र , त–– | त–– , तत्रत | {1 त–– , ––– :॥ }",
        "{2 त–– , ––त्र ॥ }",
        "॥ त–त , त्र–त्र | त–– , ––त्र | ऽऽऽ , त–त | त–– , ––त्र |",
        "| त–त , त्र–त्र | त–– , ––त्र | तत्रत , त–त्र | {1 त–– , ––त्र :॥ }",
        "{2 त–– , ––– ॥ }",
        "॥ त्रऽऽ , त–– | त्रऽऽ , ऽऽऽ | ऽऽऽ , तत– | ––– , ––– |",
        "| त्रऽऽ , त–– | त्रऽऽ , ऽऽऽ | ऽऽऽ , त–त | {1 त–– , ––– :॥ }",
        "{2 त–– , ––त्र ॥ }",
        "॥ त–त , त–त्र | त–त , त–त्र | त–त , त–त्र | त–– , ––त्र |",
        "| त–त , त–त्र | त–त , त–त्र | त–– , त्रतत | {1 त–– , ––त्र :॥ }",
        "{2 त–– , ––– ॥ }"
      ]
    }
  }
}
