{
  "format": "ghosh-notation/1",
  "id": "deep",
  "kind": "rachana",
  "title": {
    "dev": "दीप",
    "rom": "Deep"
  },
  "section": "prachalan-shankh",
  "parts": {
    "shankh": {
      "source": {
        "book": "shankh",
        "page": 7,
        "pdfPage": 26,
        "edition": 6
      },
      "tala": "खेमटा",
      "laya": 360,
      "status": "checked",
      "checkedBy": "Claude: line-by-line comparison with the page image, 2026-10-20",
      "lines": [
        "॥ॐ॥ पगस , प.ऽऽ | सऽस , गऽग | पऽऽ , प.प.प. | सऽ– , ––– ॥",
        "॥ पऽप , गऽग | सऽ– , ––प. | सप.स , गसग | पऽप. , सऽग |",
        "| पऽप , गऽग | सऽ– , ––प. | सप.स , गसग | सऽ– , ––– :॥",
        { "t": ", –सस ॥", "pickup": true
        },
        "॥ सऽस , सप.स | गऽग , गसग | पऽग , सऽग | पऽ– , –सस |",
        "| सऽस , सप.स | गऽग , गसग | पगस , प.प.ऽ | सऽ– , ––– :॥",
        "॥ गऽप , सऽग | प.ऽस , गऽप | सऽग , प.सग | पगस , प.ऽ– |",
        "| गऽप , सऽग | प.ऽस , गऽप | सऽग , प.प.प. | सऽ– , ––– :॥"
      ]
    },
    "anak": {
      "source": {
        "book": "anak",
        "page": 8,
        "pdfPage": 29,
        "edition": 6
      },
      "tala": "खेमटा",
      "laya": 360,
      "status": "checked",
      "checkedBy": "Claude: line-by-line comparison with the page image, 2026-10-20",
      "lines": [
        "॥ॐ॥ ततत , त्रऽऽ | त–त , त–त | त्रऽऽ , ततत | त–– , ––– ॥",
        "॥ त–त , त–त | त्रऽऽ , ऽऽऽ | ततत , ततत | त–त , त–त |",
        "| त–त , त–त | त्रऽऽ , ऽऽऽ | ततत , ततत | {1 त–– , ––– :॥ }",
        "{2 त–– , ––त्र ॥ }",
        "॥ ऽऽत , ततत | त–त , ततत | त–त , त–त | त्रऽऽ , ऽऽऽ |",
        "| ऽऽत , ततत | त–त , ततत | ततत , तत– | {1 त–– , ––त्र :॥ }",
        "{2 त–– , ––– ॥ }",
        "॥ त–त , त–त | त–त , त–त | त–त , ततत | ततत , त–– |",
        "| त–त , त–त | त–त , त–त | त्रऽऽ , ततत | त–– , ––– :॥"
      ]
    }
  }
}
