{
  "format": "ghosh-notation/1",
  "id": "vinayak",
  "kind": "rachana",
  "title": {
    "dev": "विनायक",
    "rom": "Vinayak"
  },
  "section": "prachalan-shankh",
  "parts": {
    "shankh": {
      "source": {
        "book": "shankh",
        "page": 10,
        "pdfPage": 29,
        "edition": 6
      },
      "tala": "केरवा",
      "laya": 120,
      "status": "checked",
      "checkedBy": "Claude: line-by-line comparison with the page image, 2026-10-20",
      "lines": [
        "॥ॐ॥ प [ऽप] | [प.स] [ऽग] | [पपपऽ] [पप] | प [ऽ–] ॥",
        "॥ [प.स] [ऽग] | [पग] [ऽस] | [सग] [ऽग] | [पऽपप] [प–] |",
        "| [प.स] [ऽग] | प. [प.प.] | [सग] [पग] | स [ऽग] |",
        "| [प.स] [ऽग] | [पग] [ऽस] | [सग] [ऽग] | [पऽपप] [प–] |",
        "| [सग] [पग] | [सग] [पग] | [सगपग] [प.ऽऽप.] | [स–] – :॥",
        "॥ [गप] [ऽग] | [पऽपप] [पप] | – – | – – |",
        "| [पग] [ऽग] | [–स] [–स] | [गपगस] [प.स] | [गप] [गस] |",
        "| [गप] [ऽग] | [पऽपप] [पप] | – – | – – |",
        "| [पग] [ऽग] | [–स] [–स] | [प.प.] ग | स [ऽ–] :॥",
        "॥ [प.प.] [स–] | [सग] [स–] | [सगपऽ] [गस] | प [ऽप] |",
        "| [प.प.] [स–] | [सग] [स–] | [सगपऽ] [प.प.] | [स–] – :॥"
      ]
    },
    "anak": {
      "source": {
        "book": "anak",
        "page": 11,
        "pdfPage": 32,
        "edition": 6
      },
      "tala": "केरवा",
      "laya": 120,
      "status": "checked",
      "checkedBy": "Claude: line-by-line comparison with the page image, 2026-10-20",
      "lines": [
        "॥ॐ॥ त्र ऽ | [तत] [–त] | [ततत–] [तत्र] | त – ॥",
        "॥ [–त्र] [तत] | [–त] [तत] | [–त्र] [तत] | [––तत] त |",
        "| [–त्र] [तत] | [–त] [तत] | [–त] [–त] | त्र [ऽत] |",
        "| [–त्र] [तत] | [–त] [तत] | [–त्र] [तत] | [––तत] त |",
        "| [–त] [–त] | [–त] [–त] | [तततत] [त––त] | त – :॥",
        "॥ [तत्र] [ऽत] | [++] [++] | [थ^त] [थ^त] | [`त्रत^–तत] [तत] |",
        "| [तत] [–त] | [–त] [–त] | [तततत] [तत] | [तत्र] [तत] |",
        "| [तत्र] [ऽत] | [++] [++] | [थ^त] [थ^त] | [`त्रत^–तत] [तत] |",
        "| [तत] [–त] | [–त] [–त] | [–त्र] [तत] | त – :॥",
        "॥ [तत्र] त | [++] + | [ततत–] [तत] | त्र ऽ |",
        "| [तत्र] त | [++] + | [ततत–] [तत] | त – :॥"
      ]
    }
  }
}