{
  "format": "ghosh-notation/1",
  "id": "marva",
  "kind": "rachana",
  "title": {
    "dev": "मारवा",
    "rom": "Marva"
  },
  "section": "mand-vanshi",
  "raga": {
    "name": "मारवा",
    "aroha": "स री_ ग म_ ध नि स'",
    "avaroha": "स' नि ध म_ ग री_ स"
  },
  "parts": {
    "vanshi": {
      "source": {
        "book": "vanshi",
        "page": 74,
        "pdfPage": 94,
        "edition": 6
      },
      "tala": "दादरा",
      "laya": 120,
      "status": "checked",
      "checkedBy": "Claude: line-by-line comparison with the page image, 2026-10-20",
      "lines": [
        "॥ॐ॥ स नि. री_ | ग म_ ग | ध ऽ ऽ | [ऽ–] म_ ध |",
        "| नि ध म_ | ध म_ ग | री_ ऽ ऽ | [ऽ–] री_ ग |",
        "| म_ ग म_ | ध नि ध | री_' ऽ ऽ | [ऽ–] नि ध |",
        "| नि ध म_ | ध [म_ग] री_ | स ऽ ऽ | स – – :॥",
        "॥ नि. री_ ग | री_ – ग | नि. री_ ग | री_ री_ ग |",
        "| नि. री_ ग | री_ – [गम_] | ध ध [म_ग] | री_ – – |",
        "| नि. री_ ग | री_ – ग | नि. री_ ग | री_ री_ ग |",
        "| नि. री_ ग | री_ – [गम_] | ध [म_ग] री_ | {1 स – – :॥ }",
        "{2 स – री_' ॥ }",
        "॥ नि ध म_ | ध म_ ग | री_ री_ री_ | [गम_] [धनि] री_' |",
        "| नि ध म_ | ध म_ ग | म_ [धनि] री_' | री_' – री_' |",
        "| नि ध म_ | ध म_ ग | री_ री_ री_ | [गम_] [धनि] री_' |",
        "| नि ध म_ | ध [म_ग] री_ | स – [सस] | {1 [स–] – री_' :॥ }",
        "{2 [स–] – [सनि.] ॥ }",
        "॥ री_ ऽ [गनि.] | री_ ऽ [म_नि] | ध ऽ [म_ग] | [री_–] – [गम_] |",
        "| ध ऽ [निम_] | ध ऽ [म_ग] | म_ [ध–] [स'नि] | री_' – [ग'री_'] |",
        "| स' ऽ [री_'नि] | ध ऽ [म_ध] | नि ध [म_ग] | [री_–] – [री_'–] |",
        "| नि म_ नि | ध [म_ग] री_ | स – [सस] | {1 [स–] – [सनि.] :॥ }",
        "{2 [स–] – – ॥ }"
      ]
    },
    "anak": {
      "source": {
        "book": "anak",
        "page": 89,
        "pdfPage": 110,
        "edition": 6
      },
      "tala": "दादरा",
      "laya": 120,
      "status": "checked",
      "checkedBy": "Claude: line-by-line comparison with the page image, 2026-10-20",
      "lines": [
        "॥ॐ॥ त [तत] त | त त त | त्र ऽ ऽ | त त त |",
        "| त [तत] त | त त त | त्र ऽ ऽ | त त त |",
        "| त [तत] त | त त त | त्र ऽ ऽ | त त त |",
        "| त त त | त [तत] त | त्र ऽ ऽ | त – – :॥",
        "॥ त्र [तत] [तत] | [तत्र] [तत] त | त्र [तत] [तत] | [तत्र] [तत] [तत] |",
        "| त्र [तत] [तत] | [तत्र] [तत] त | त्र ऽ ऽ | [तत्र] [तत] त |",
        "| त्र [तत] [तत] | [तत्र] [तत] त | त्र [तत] [तत] | [तत्र] [तत] [तत] |",
        "| त्र [तत] [तत] | [तत्र] [तत] त | त्र ऽ ऽ | [तत्र] [तत] त :॥",
        "॥ त्र ऽ त | त [तत] त | त त त | त्र ऽ त |",
        "| त्र ऽ त | त त त | त [तत] त | त – – |",
        "| त्र ऽ त | त [तत] त | त त त | त्र ऽ त |",
        "| त्र ऽ त | त त त | त [त–त] त | – – – :॥",
        "॥ त [त्रत] – | त [त्रत] – | त्र ऽ त | त्र ऽ त |",
        "| [तत्र] [तत] [तततत] | [तत्र] [तत] [तततत] | त [त्रत] – | त [त्रत] – |",
        "| त [तत्र] – | [तत्र] [तत्र] [तततत] | [तत्र] [तत्र] [तततत] | त [त्रत] – |",
        "| त [त्रत] – | त [त्रत] – | [तत्र] [तत] [त––त] | त – – :॥"
      ]
    }
  }
}
