{
  "format": "ghosh-notation/1",
  "id": "dhvajaropanam",
  "kind": "rachana",
  "title": {
    "dev": "ध्वजारोपणम्",
    "rom": "Dhvajaropanam"
  },
  "section": "naimittik",
  "raga": {
    "name": "रागेश्री",
    "aroha": "स ग म ध नि स'",
    "avaroha": "स' नि_ ध म ग म री स"
  },
  "text": [
    "॥ ॐ नमोऽस्तुते ध्वजाय । ॐ नमोऽस्तुते ध्वजाय ॥ सकल-भुवन-जन-हिताय । सकल-भुवन-जन-हिताय ॥",
    "॥ विभव सहित विमल चरित बोधकाय मंगलाय ते सततम् ॥",
    "॥ ॐ नमोऽस्तुते ध्वजाय । ॐ नमोऽस्तुते ध्वजाय ॥ ॐ ऽऽऽ ॥"
  ],
  "usage": [
    "“ध्वजारोपणम्” - रचना केवल संघ में भगवा ध्वजारोहण के लिए ही बजाना चाहिए। विद्यालय तथा अन्य संस्थाओं के ध्वजारोहण के लिए इसका प्रयोग वर्जित है।"
  ],
  "standing": true,
  "notes": [
    "Anak: the wedge over the closing त्र ऽ ऽ is read as a diminuendo (>) on the held roll."
  ],
  "parts": {
    "vanshi": {
      "source": {
        "book": "vanshi",
        "page": 62,
        "pdfPage": 82,
        "edition": 6
      },
      "tala": "दादरा",
      "laya": 120,
      "status": "checked",
      "lines": [
        { "t": "॥ॐ॥ स' ऽ स' | ध ऽ ध | ग ऽ [(मग)] | री ऽ स :॥", "lyrics": [
            "ओम्",
            "",
            "न",
            "मो",
            "",
            "स्तु",
            "ते",
            "",
            "ध्व",
            "जा",
            "",
            "य"
          ]
        },
        { "t": "॥ नि. स ग | म ध ध | ग ग [(मग)] | री ऽ स :॥", "lyrics": [
            "स",
            "क",
            "ल",
            "भु",
            "व",
            "न",
            "ज",
            "न",
            "हि",
            "ता",
            "",
            "य"
          ]
        },
        { "t": "॥ नि. स ग | म ध ध | ग म ध | नि स' स' |", "lyrics": [
            "वि",
            "भ",
            "व",
            "स",
            "हि",
            "त",
            "वि",
            "म",
            "ल",
            "च",
            "रि",
            "त"
          ]
        },
        { "t": "| ग' ऽ ग' | स' ऽ स' | ग' ऽ ग' | स' ऽ नि_ |", "lyrics": [
            "बो",
            "",
            "ध",
            "का",
            "",
            "य",
            "मं",
            "",
            "ग",
            "ला",
            "",
            "य"
          ]
        },
        { "t": "| ध ऽ ग | म (ध नि) ॥ स' ऽ स' | ध ऽ ध |", "lyrics": [
            "ते",
            "",
            "स",
            "त",
            "तं",
            "ऽ",
            "ओम्",
            "",
            "न",
            "मो",
            "",
            "स्तु"
          ]
        },
        { "t": "| ग ऽ [(मग)] | री ऽ स :॥ स' ऽ ऽ | ऽ – – ॥", "lyrics": [
            "ते",
            "",
            "ध्व",
            "जा",
            "",
            "य",
            "ओम्",
            "ऽ",
            "ऽ",
            "ऽ",
            "",
            ""
          ]
        }
      ],
      "checkedBy": "Claude: line-by-line comparison with the page image, 2026-10-20"
    },
    "anak": {
      "source": {
        "book": "anak",
        "page": 101,
        "pdfPage": 122,
        "edition": 6
      },
      "tala": "दादरा",
      "laya": 120,
      "status": "checked",
      "lines": [
        "॥ॐ॥ त्र ऽ ऽ | त [तत] त | त्र ऽ ऽ | त [तत] त :॥",
        "॥ त त्र त | त [तत] [तत] | त त त | त [तत] त :॥",
        "॥ त त त | त [तत] त | त त त | त [तत] त |",
        "| त्र ऽ त | त [ततत] त | त्र ऽ त | त [ततत] त |",
        "| त्र ऽ त | त [तत] त ॥ त्र ऽ ऽ | त [तत] त |",
        "| त्र ऽ ऽ | त [तत] त :॥ त्र> ऽ ऽ | ऽ – – ॥"
      ],
      "checkedBy": "Claude: line-by-line comparison with the page image, 2026-10-20"
    }
  }
}
