{
  "format": "ghosh-notation/1",
  "id": "madhavanitya",
  "kind": "rachana",
  "title": {
    "dev": "माधवनित्या",
    "rom": "Madhavanitya"
  },
  "section": "prachalan-vanshi",
  "parts": {
    "vanshi": {
      "source": {
        "book": "vanshi",
        "page": 56,
        "pdfPage": 76,
        "edition": 6
      },
      "tala": "केरवा",
      "laya": 120,
      "status": "checked",
      "checkedBy": "Claude: line-by-line comparison with the page image, 2026-10-20",
      "lines": [
        "॥ॐ॥ [निऽऽध] [पऽऽम] | ग [ऽस] | री [ऽऽ(गरी)] | [स–] – ॥",
        "॥ [स'–] [निऽऽध] | प [(पधनि)नि] | स' [निऽऽध] | प [ऽ–] |",
        "| [स'–] [निऽऽध] | प [(पधनि)नि] | स' [निऽऽध] | प [(रीमपध)] |",
        "| [ध^–] [पऽऽम] | री [गऽऽरी] | स ऽ | [ऽ–] – :॥",
        "॥ [सऽऽरी] [गम] | प ऽ | [धप] [मध] | प [ऽ–] |",
        "| [गऽऽम] [पऽऽध] | नि ऽ | [गम] [पध] | स' ऽ |",
        "| [स'नि] नि_ | ध [ऽ–] | [पग] [धप] | प [ऽ–] |",
        "| [ध^–] [पऽऽम] | री [गऽऽरी] | स ऽ | [ऽ–] – :॥",
        "॥ स [रीस] | री ऽ | [मग] [मप] | प ऽ |",
        "| [गम] प | नि ऽ | [पध] [धप] | स' ऽ |",
        "| [स'री'स'ऽ] नि | ध ऽ | [गम] [पध] | प ऽ |",
        "| [ध^–] [पऽऽम] | री [गऽऽरी] | स ऽ | [ऽ–] – :॥",
        "॥ [सरी] स | नि. [ऽ–] | [प.ध.] प. | स ऽ |",
        "| [सरी] स | ग [ऽ–] | [गम] ग | प ऽ |",
        "| [गम] प | नि ऽ | स' [ऽऽधनि] | स' ऽ |",
        "| [स'नि] [ऽनि_] | ध ऽ | [निध] [पम] | ग ऽ |",
        "| [ध^–] [पऽऽम] | री [गऽऽरी] | स ऽ | [ऽ–] [(रीमपध)] |",
        "| [ध^–] [पऽऽम] | री [गऽऽरी] | स ऽ | [ऽ–] – :॥",
        "॥ [स'–] [–प] | [स'–] [–प] | स' ऽ | [ऽ–] – ॥"
      ]
    },
    "anak": {
      "source": {
        "book": "anak",
        "page": 74,
        "pdfPage": 95,
        "edition": 6
      },
      "tala": "केरवा",
      "laya": 120,
      "status": "checked",
      "checkedBy": "Claude: line-by-line comparison with the page image, 2026-10-20",
      "lines": [
        "॥ॐ॥ [त––त] [त––त] | त्र [ऽत] | त [–त] | त – ॥",
        "॥ थ त्र | ऽ [तततत] | त्र [त––त] | त – |",
        "| थ त्र | ऽ [तततत] | त्र [त––त] | त – |",
        "| थ त्र | ऽ [त––त] | त्र ऽ | त – :॥",
        "॥ [त––त] [तत] | [–त] [–त] | [तत] [–त] | त्र ऽ |",
        "| [तत] [–त] | [–त] [तत] | [तत] [तत] | त्र ऽ |",
        "| [तत] [त––त] | त्र [ऽत] | [तत] [तत] | त्र [ऽत] |",
        "| थ त्र | ऽ [त––त] | त्र ऽ | त – :॥",
        "॥ त्र ऽ | [तत] [–त] | [तत] [तत] | [–त] [–त] |",
        "| त्र त | [–त] [–त] | [तत] [तत] | [–त] [–त] |",
        "| [त्रत] त | [–त] [–त] | [तत] [तत] | [–त] [–त] |",
        "| थ त्र | ऽ [त––त] | त्र ऽ | त – :॥",
        "॥ त्र त | + + | [–त] [–त] | त्र ऽ |",
        "| ऽ त | + + | [–त] [–त] | त्र ऽ |",
        "| [तत] त | त्र ऽ | त [–त्र] | त – |",
        "| [तत] [–त] | त्र ऽ | [तत] त्र | त – |",
        "| थ त्र | ऽ [त––त] | त्र ऽ | त – |",
        "| थ त्र | ऽ [त––त] | त्र ऽ | त – :॥",
        "॥ थ [–त्र] | त [–त] | त्र ऽ | त – ॥"
      ]
    }
  }
}
