{
  "format": "ghosh-notation/1",
  "id": "ganesh",
  "kind": "rachana",
  "title": {
    "dev": "गणेश",
    "rom": "Ganesh"
  },
  "section": "prachalan-vanshi",
  "raga": {
    "name": "सारंग",
    "aroha": "स री म प नि स'",
    "avaroha": "स' नि_ प म री स"
  },
  "notes": [
    "आनक चरण ७ ग्रंथात आठ ओळी :॥ असा छापला आहे, तर वंशीत तोच चरण सोळा ओळी पुनरावृत्तीशिवाय लिहिला आहे. दोन्ही भाग एकत्र चालावेत म्हणून आनकाचा चरण ७ येथे दोनदा लिहिला आहे (पहिल्या वेळी शेवट |, दुसऱ्या वेळी ॥)."
  ],
  "parts": {
    "vanshi": {
      "source": {
        "book": "vanshi",
        "page": 42,
        "pdfPage": 62,
        "edition": 6
      },
      "tala": "खेमटा",
      "laya": 360,
      "status": "checked",
      "checkedBy": "Claude: line-by-line comparison with the page image, 2026-10-20",
      "lines": [
        "॥ॐ॥ पऽप , पऽप | पऽऽ , नि_पम | रीऽऽ , रीमरी | सऽ– , सऽ– ॥",
        "॥ रीऽम , रीऽस | रीऽम , पनि_प | निऽस' , री'ऽस' | नि_ऽऽ , (मऽप) |",
        "| रीऽम , रीऽस | रीऽम , पनि_प | रीऽम , रीऽनि. | सऽऽ , ऽऽ– :॥",
        "॥ पस'नि , स'ऽस' | मनि_प , नि_ऽनि_ | रीपम , पऽप | निऽनि , स'ऽ– |",
        "| पस'नि , स'ऽस' | मनि_प , नि_ऽनि_ | रीमप , नि_पम | रीमरी , सऽ– :॥",
        "॥ रीऽम , रीऽस | रीऽम , पनि_प | निऽस' , री'ऽस' | नि_ऽऽ , (मऽप) |",
        "| रीऽम , रीऽस | रीऽम , पनि_प | रीऽम , रीऽनि. | सऽऽ , ऽऽ– :॥",
        "॥ स'निरी' , स'ऽ– | पनि_प , मपऽ | मरीप , मनि_प | स'निरी' , स'ऽस' |",
        "| स'निरी' , स'ऽ– | पनि_प , मपऽ | रीऽम , पऽम | रीऽऽ , सऽ– :॥",
        "॥ स'ऽस' , स'ऽनि | पऽप , पऽम | रीऽरी , मऽरी | सऽनि. , सऽरी |",
        "| रीऽम , मऽप | पऽनि , स'ऽरी' | स'ऽ– , स'ऽ– | सऽ(नि. , सऽरी) ॥",
        "॥ मऽऽ , ऽऽऽ | ऽऽ(नि , स'ऽनि_) | पऽऽ , ऽऽऽ | ऽऽ(री , मऽरी |",
        "| प)ऽऽ , ऽऽऽ | रीऽम , पऽनि | स'ऽ– , स'ऽ– | ––(नि , स'ऽनि) |",
        "| री'ऽऽ , ऽऽऽ | ऽऽ(नि , स'ऽरी') | स'ऽऽ , ऽऽऽ | ऽऽ(री' , स'ऽनि |",
        "| प)ऽ(स' , नि_ऽप | म)ऽ– , (पऽम | री)ऽ(प , मऽरी | स)ऽ– , नि_नि_नि_ |",
        "| नि_ऽऽ , ऽ(पम) | नि_ऽऽ , ऽ(पम) | (नि_पम) , (नि_पम) | नि_ऽ– , पपप |",
        "| पऽऽ , ऽ(मरी) | पऽऽ , ऽ(मरी) | (पमरी) , (पमरी) | पऽ– , (मपनि) |",
        "| स'ऽऽ , ऽऽ(नि | स')ऽऽ , ऽऽ(नि | स')ऽऽ , ऽऽऽ | ऽऽ– , (पनिस') |",
        "| री'ऽऽ , ऽऽ(स' | री')ऽऽ , ऽऽस' | री'ऽऽ , ऽऽऽ | ऽऽ– , (नि.सरी) |",
        "| मऽऽ , ऽऽऽ | ऽऽ(नि , स'ऽनि_) | पऽऽ , ऽऽऽ | ऽऽ(री , मऽरी |",
        "| प)ऽऽ , ऽऽऽ | रीऽम , पऽनि | स'ऽ– , स'ऽ– | ––(नि , स'ऽनि) |",
        "| री'ऽऽ , ऽऽऽ | ऽऽ(नि , स'ऽरी') | स'ऽऽ , ऽऽऽ | ऽऽ(री' , स'ऽनि |",
        "| प)ऽ(स' , नि_ऽप | म)ऽ– , (पऽम | री)ऽ(प , मऽरी | स)ऽ– , नि_.नि_.नि_. |",
        "| (नि_.ऽप.) , नि.नि.नि. | (सऽरी) , नि_.नि_.नि_. | (नि_.ऽप.) , (नि_.ऽऽ | स)ऽ– , नि_.नि_.नि_. |",
        "| (नि_.ऽप.) , नि.नि.नि. | (सऽरी) , नि_.नि_.नि_. | (नि_.ऽप.) , सऽऽ | ––(नि_. , सऽरी |",
        "| म)ऽ(स , रीऽम | प)ऽ– , (मऽप | नि_)ऽ(म , पऽनि | स')ऽ– , री'री'री' |",
        "| स'ऽऽ , नि_ऽऽ | पऽऽ , मऽऽ | रीऽऽ , मऽरी | सऽ– , ––– ॥"
      ]
    },
    "anak": {
      "source": {
        "book": "anak",
        "page": 66,
        "pdfPage": 87,
        "edition": 6
      },
      "tala": "खेमटा",
      "laya": 360,
      "status": "checked",
      "checkedBy": "Claude: line-by-line comparison with the page image, 2026-10-20",
      "lines": [
        "॥ॐ॥ त–त , त–त | त्रऽऽ , ऽऽऽ | त–– , ततत | त–– , ––– ॥",
        "॥ त–त्र , त–त | त–त्र , ततत | त–त्र , त–त | त–– , ततत |",
        "| त–त्र , त–त | त–त्र , ततत | त–त्र , त–त | त–– , ––– :॥",
        "॥ ततत , त–त | ततत , त–त | ततत , त–त | त्रऽऽ , त–– |",
        "| ततत , त–त | ततत , त–त | ततत , ततत | त्रऽऽ , त–– :॥",
        "॥ त–त्र , त–त | त–त्र , ततत | त–त्र , त–त | त–– , ततत |",
        "| त–त्र , त–त | त–त्र , ततत | त–त्र , त–त | त–– , ––– :॥",
        "॥ त्रऽऽ , त–– | त्रऽऽ , तत्रत | तत्रत , तत्रत | तत्रत , त–त |",
        "| त्रऽऽ , त–– | त्रऽऽ , तत्रत | तत्रत , तत्रत | {1 त्रऽऽ , त–– :॥ }",
        "{2 त्रऽऽ , त–त्र ॥ }",
        "॥ त–त्र , त–त्र | त–त्र , त–त्र | त–त्र , त–त्र | त–त्र , त–– |",
        "| त–त्र , त–त्र | त–त्र , त–त्र | त–– , त–– | त–– , ––– ॥",
        "॥ त्रऽऽ , ऽऽऽ | त–त , त–त | त्रऽऽ , ऽऽऽ | त–त , त–त |",
        "| त्रऽऽ , ऽऽऽ | त–त , त–त | त–त्र , त–त्र | त–त , त–त |",
        "| त्रऽऽ , ऽऽऽ | त–त , त–त | त्रऽऽ , ऽऽऽ | त–त , त–त |",
        "| त–त्र , त–त्र | त–– , त–त्र | त–त्र , त–त्र | त–– , ततत |",
        "| त्रऽऽ , ततत | त्रऽऽ , ततत | त्रऽऽ , ऽऽऽ | त–– , ततत |",
        "| त्रऽऽ , ततत | त्रऽऽ , ततत | त्रऽऽ , ऽऽऽ | त–– , ततत |",
        "| त–त्र , त–त्र | त–– , त–त्र | त्रऽऽ , ऽऽऽ | त–– , ततत |",
        "| त–त्र , त–त्र | त–त्र , त–त्र | त्रऽऽ , ऽऽऽ | त–– , ––– |",
        "| त्रऽऽ , ऽऽऽ | त–त , त–त | त्रऽऽ , ऽऽऽ | त–त , त–त |",
        "| त्रऽऽ , ऽऽऽ | त–त , त–त | त–त्र , त–त्र | त–त , त–त |",
        "| त्रऽऽ , ऽऽऽ | त–त , त–त | त्रऽऽ , ऽऽऽ | त–त , त–त |",
        "| त–त्र , त–त्र | त–– , त–त्र | त–त्र , त–त्र | त–– , ततत |",
        "| त्रऽऽ , ततत | त्रऽऽ , ततत | त्रऽऽ , ऽऽऽ | त–– , ततत |",
        "| त्रऽऽ , ततत | त्रऽऽ , ततत | त्रऽऽ , ऽऽऽ | त–– , ततत |",
        "| त–त्र , त–त्र | त–– , त–त्र | त्रऽऽ , ऽऽऽ | त–– , ततत |",
        "| त–त्र , त–त्र | त–त्र , त–त्र | त्रऽऽ , ऽऽऽ | त–– , ––– ॥"
      ]
    }
  }
}
