{
  "format": "ghosh-notation/1",
  "id": "shriram",
  "kind": "rachana",
  "title": {
    "dev": "श्रीराम",
    "rom": "Shriram"
  },
  "section": "prachalan-shankh",
  "parts": {
    "shankh": {
      "source": {
        "book": "shankh",
        "page": 1,
        "pdfPage": 20,
        "edition": 6
      },
      "tala": "केरवा",
      "laya": 120,
      "status": "checked",
      "checkedBy": "Claude: line-by-line comparison with the page image, 2026-10-20",
      "lines": [
        "॥ॐ॥ [प.स] [सगऽस] | प. [सग] | [प.ऽप.प.] [प.प.] | [स–] – ॥",
        "॥ [प.प.] [सग] | [प.प.] [सग] | [प.ऽप.प.] [प.प.] | स [ऽग] |",
        "| [प.प.] [सग] | [प.प.] [सग] | [प.ऽप.प.] [प.प.] | [स–] – :॥",
        "॥ [सगऽस] [प.स] | [प.स] [गस] | [सगऽस] [गस] | प. [ऽ–] |",
        "| [सगऽस] [प.स] | [प.स] [गस] | [सगऽस] [प.प.] | [स–] – :॥",
        "॥ [गस] [प.स] | [गऽऽग] [गग] | [प.स] [ऽग] | प [ऽ–] |",
        "| [गस] [प.स] | [गऽऽग] [गग] | [प.स] [ऽग] | स [ऽ–] :॥"
      ]
    },
    "anak": {
      "source": {
        "book": "anak",
        "page": 1,
        "pdfPage": 22,
        "edition": 6
      },
      "tala": "केरवा",
      "laya": 120,
      "status": "checked",
      "checkedBy": "Claude: line-by-line comparison with the page image, 2026-10-20",
      "lines": [
        "॥ॐ॥ [तत] [तत–त] | त्र [तत] | [त–तत] [तत] | त – ॥",
        "॥ त्र [तत] | [तत्र] [तत] | [त–तत] [तत] | त्र [ऽत] |",
        "| त्र [तत] | [तत्र] [तत] | [त–तत] [तत] | त – :॥",
        "॥ [तत–त] [तत] | [तत्र] [तत] | [तत–त] [तत] | त्र ऽ |",
        "| [तत–त] [तत] | [तत्र] [तत] | [तत–त] [तत्र] | त – :॥",
        "॥ [त्रत] [त्रत] | [त––त] [तत] | [तत] [–त] | त्र त |",
        "| [त्रत] [त्रत] | [त––त] [तत] | [तत] [–त] | त – :॥"
      ]
    }
  }
}
